{
  "$schema": "https://json-schema.org/draft/2020-12/schema",
  "title": "QuestionsCollection",
  "description": "Esquema JSON do arquivo de questões do Quiz Computacional",
  "type": "array",
  "minItems": 10,
  "maxItems": 10,
  "items": {
    "type": "object",
    "required": ["id", "statement", "options", "correctIndex", "explanation"],
    "additionalProperties": false,
    "properties": {
      "id": {
        "type": "integer",
        "minimum": 1
      },
      "statement": {
        "type": "string",
        "minLength": 10
      },
      "options": {
        "type": "array",
        "minItems": 4,
        "maxItems": 4,
        "items": {
          "type": "string",
          "minLength": 1
        }
      },
      "correctIndex": {
        "type": "integer",
        "minimum": 0,
        "maximum": 3
      },
      "explanation": {
        "type": "string",
        "minLength": 5
      }
    }
  }
}
